{
  "system_name": "UVA_GPS_DENIED_RUNTIME_SAMPLE",
  "version": "1.0",
  "dataset_type": "non_production_example",
  "description": "Minimal non-production runtime example that points to safe sample configuration files.",
  "coordinate_frame": "local_enu",
  "runtime_modes_supported": [
    "simulation",
    "bench",
    "production",
    "edge_swarm"
  ],
  "global_configuration": {
    "runtime_mode": "bench",
    "anchor_config_path": "config/anchors.example.json",
    "lidar_config_path": "config/lidar.example.json",
    "detector_labels_path": "config/detector_labels.example.json",
    "telemetry_publish_rate_hz": 5,
    "backend_mode": "bench",
    "safety_manager_enabled": true,
    "simulation_fallback_enabled": false,
    "pre_arm_required": true,
    "bench_validation_required": true,
    "estimator": {
      "mode": "minimal",
      "enable_experimental_hybrid": false,
      "enable_fej": false,
      "enable_msckf": false,
      "enable_loop_closure_correction": false,
      "enable_automatic_zupt": false,
      "shadow": {
        "enabled": false,
        "comparison_enabled": true,
        "implementation": "minimal_eskf_clone",
        "max_queue_depth": 512,
        "max_lag_ms": 100.0,
        "position_divergence_m": 0.25,
        "velocity_divergence_mps": 0.2,
        "orientation_divergence_deg": 5.0,
        "required_consecutive_divergent_samples": 10
      },
      "reject_non_finite_measurements": true,
      "require_monotonic_timestamps": true,
      "max_imu_dt_s": 0.1,
      "diagnostics_enabled": true
    }
  }
}
